# name: test/sql/fts/test_layered_search.test
# description: Layered BM25 search sidecar and incremental maintenance
# group: [fts]

require skip_reload

require fts

require no_alternative_verify

statement ok
CREATE TABLE documents(id VARCHAR NOT NULL, body VARCHAR, author VARCHAR)

statement ok
INSERT INTO documents VALUES
    ('doc1', 'quacking quacking quacking', 'Hannes'),
    ('doc2', 'barking barking barking barking', 'Mark'),
    ('doc3', 'meowing meowing meowing meowing meowing 999', 'Laurens')

statement ok
PRAGMA create_fts_index('documents', 'id', 'body', 'author', stemmer='none', stopwords='none', ignore='(\\.|[^a-z0-9])+', layered_search=true, incremental=true)

query I
SELECT count(*) FROM fts_main_documents.term_stats
----
7

query I
SELECT CASE WHEN count(*) > 0 THEN 1 ELSE 0 END FROM fts_main_documents.term_grams
----
1

query I
SELECT count(*)
FROM (
    SELECT termid, lag(termid) OVER () AS previous_termid
    FROM fts_main_documents.terms
) ordered_terms
WHERE previous_termid IS NOT NULL
  AND termid < previous_termid
----
0

query I
SELECT docname
FROM fts_main_documents.search_layered_bm25('quack', fields := 'body', enable_short_fuzzy := false)
----
doc1

query I
SELECT id
FROM (
    SELECT *,
           fts_main_documents.match_layered_bm25(id, 'quack', fields := 'body', enable_short_fuzzy := false) AS score
    FROM documents
) sq
WHERE score IS NOT NULL
ORDER BY score DESC
----
doc1

query I
SELECT docname
FROM fts_main_documents.search_layered_bm25('mark', fields := 'author', enable_short_fuzzy := false)
----
doc2

query I
SELECT docname
FROM fts_main_documents.search_layered_bm25('999', fields := 'body', enable_short_fuzzy := false)
----
doc3

statement ok
INSERT INTO documents VALUES ('doc4', 'chirping chirping', 'Mark')

query II
SELECT term, df
FROM fts_main_documents.term_stats
WHERE term IN ('chirping', 'mark')
ORDER BY term
----
chirping	1
mark	2

query I
SELECT CASE WHEN count(*) > 0 THEN 1 ELSE 0 END
FROM fts_main_documents.term_grams AS tg
JOIN fts_main_documents.term_stats AS ts USING (termid)
WHERE ts.term = 'chirping'
----
1

query I
SELECT docname
FROM fts_main_documents.search_layered_bm25('chirp', fields := 'body', enable_short_fuzzy := false)
----
doc4

statement ok
DELETE FROM documents WHERE id = 'doc3'

query I
SELECT count(*) FROM fts_main_documents.term_stats WHERE term = 'meowing'
----
0

query I
SELECT count(*)
FROM fts_main_documents.search_layered_bm25('meow', fields := 'body', enable_short_fuzzy := false)
----
0

statement ok
CREATE TABLE plain_documents(id VARCHAR, body VARCHAR)

statement ok
INSERT INTO plain_documents VALUES ('doc1', 'alpha beta')

statement ok
PRAGMA create_fts_index('plain_documents', 'id', 'body', stemmer='none', stopwords='none')

query I
SELECT count(*)
FROM information_schema.tables
WHERE table_schema = 'fts_main_plain_documents'
  AND table_name = 'term_stats'
----
0
